[
  {
    "id": "12121212-1212-4121-8121-121212121212",
    "siteId": "11111111-1111-4111-8111-111111111111",
    "lotId": "66666666-6666-4666-8666-666666666666",
    "tankId": "33333333-3333-4333-8333-333333333333",
    "sampleCode": "ECH-C01-0518",
    "measuredAt": "2026-05-18T09:00:00.000Z",
    "analystId": "aaaaaaaa-aaaa-4aaa-8aaa-aaaaaaaaaaaa",
    "results": { "ph": 3.55, "densite": 1.018, "temperatureC": 13.4 },
    "compliant": true,
    "createdAt": "2026-05-18T09:00:00.000Z",
    "updatedAt": "2026-05-18T09:00:00.000Z"
  }
]

